{
    "id": "aptos-names-service",
    "name": "Aptos Names Service",
    "description": "Register your aptos domain",
    "image": "aptos-names-service.png",
    "link": "https://www.aptosnames.com/",
    "socials": [],
    "bio": "",
    "categories": [],
    "rank": "listed",
    "scheduled_highlights": []
}